{
  "manifestVersion": 2,
  "name": "Pallasite",
  "tagline": "Cosmic arcade Asteroids - mine the belt, top the chain",
  "description": "Mine a neon asteroid belt, survive the swarm, and chase the global high score.",
  "genres": [
    "arcade",
    "shooter"
  ],
  "tips": "profusemeat89@walletofsatoshi.com",
  "gameId": "pallasite",
  "order": 1,
  "accent": "#7cf3ff",
  "exec": "Pallasite.AppImage",
  "args": [
    "--no-sandbox"
  ],
  "url": "https://pallasite.app/",
  "inputModes": [
    "gamepad",
    "keyboard"
  ],
  "controller": {
    "adapter": "native"
  },
  "controlHints": [
    "LEFT STICK / D-PAD = MOVE",
    "\u24b6 / SPACE = FIRE",
    "Y / MENU = PAUSE"
  ],
  "sessionMinutes": 5,
  "players": {
    "min": 1,
    "max": 1
  },
  "network": "optional",
  "conferenceFallback": true,
  "capabilities": {
    "nostrSign": true,
    "walletPay": true,
    "persistentStorage": true,
    "externalNavigation": false
  },
  "allowedOrigins": [
    "https://pallasite.app"
  ],
  "developer": "The Crypto Donkey",
  "nostrHandoff": {
    "protocol": "gamestr-auth-v1",
    "editions": [
      "600"
    ],
    "signKinds": [
      30762,
      27235
    ]
  },
  "scoreAuthorities": [
    "fa9291d038fd1d3e4439364f289f2e53a64a1d32776ee52c000da53ebc718cdc"
  ]
}
