{
  "manifestVersion": 2,
  "name": "The Rabbit Hole",
  "tagline": "Arcade shooter - ← → move, SPACE to shoot",
  "url": "https://games.noderunners.network/spaceinvaders2/",
  "gameId": "the-rabbit-hole",
  "order": 20,
  "accent": "#a855f7",
  "heroUrl": "https://gamestr.io/games/rabbit-hole-logo.jpg",
  "textLogo": true,
  "source": "gamestr",
  "inputModes": ["gamepad", "keyboard"],
  "controller": { "adapter": "native" },
  "controlHints": [
    "D-PAD / LEFT STICK = MOVE",
    "A = SHOOT",
    "X / B = BACK / BOMB"
  ],
  "network": "required",
  "capabilities": { "nostrSign": true, "walletPay": false, "persistentStorage": false, "externalNavigation": false },
  "allowedOrigins": ["https://games.noderunners.network"]
}
