{
  "manifestVersion": 2,
  "name": "Mempool Breaker",
  "tagline": "Bitcoin brick-breaker - smash live mempool blocks",
  "url": "https://games.noderunners.network/mempoolbreaker/",
  "gameId": "mempool-breaker",
  "order": 21,
  "accent": "#f7931a",
  "heroUrl": "https://gamestr.io/games/mempool-breaker.png",
  "textLogo": true,
  "source": "gamestr",
  "inputModes": ["gamepad", "keyboard"],
  "controller": { "adapter": "native" },
  "controlHints": [
    "D-PAD / LEFT STICK = MOVE",
    "A = FIRE / CONFIRM",
    "X / B = BOMB / BACK"
  ],
  "network": "required",
  "capabilities": { "nostrSign": true, "walletPay": false, "persistentStorage": false, "externalNavigation": false },
  "allowedOrigins": ["https://games.noderunners.network"]
}
