{
  "manifestVersion": 2,
  "name": "Forge Realms",
  "tagline": "Build, battle and conquer in this Nostr RTS",
  "url": "https://forgesworn.dev/forge-realms/",
  "gameId": "forge-realms",
  "order": 10,
  "accent": "#6366f1",
  "inputModes": [
    "gamepad",
    "keyboard"
  ],
  "controller": { "adapter": "native" },
  "controlHints": [
    "LEFT STICK = CURSOR · A / B = SELECT / CANCEL",
    "RIGHT STICK / TRIGGERS = PAN / ZOOM",
    "X = ARMY · Y = BUILD · START = PAUSE"
  ],
  "network": "required",
  "capabilities": {
    "nostrSign": true,
    "walletPay": false,
    "persistentStorage": false,
    "externalNavigation": false
  },
  "allowedOrigins": [
    "https://forgesworn.dev"
  ],
  "developer": "The Crypto Donkey",
  "tips": "profusemeat89@walletofsatoshi.com"
}
