{
  "manifestVersion": 2,
  "name": "Hang On, Fren",
  "tagline": "Riviera Vespa racer - ten regions, one finish line",
  "description": "A Riviera Vespa road tribute starring DNI. Grab roses, cross ten regions, and reach the finish line before time runs out.",
  "genres": [
    "arcade",
    "racing",
    "casual"
  ],
  "gameId": "hangonfren",
  "order": 4,
  "accent": "#ffd76b",
  "url": "https://hang-on-fren.playechoseven.com/",
  "heroUrl": "https://hang-on-fren.playechoseven.com/icons/icon-512.png",
  "inputModes": [
    "gamepad",
    "keyboard"
  ],
  "controller": {
    "adapter": "native"
  },
  "controlHints": [
    "D-PAD / LEFT STICK = STEER",
    "A / X / TRIGGERS = BRAKE",
    "A OR START = BEGIN / CONTINUE"
  ],
  "network": "required",
  "capabilities": {
    "nostrSign": true,
    "walletPay": false,
    "persistentStorage": false,
    "externalNavigation": false
  },
  "allowedOrigins": [
    "https://hang-on-fren.playechoseven.com"
  ],
  "developer": "The Crypto Donkey",
  "tips": "profusemeat89@walletofsatoshi.com",
  "nostrHandoff": {
    "protocol": "gamestr-auth-v1",
    "editions": [
      "600"
    ],
    "signKinds": [
      30762,
      27235
    ]
  },
  "scoreAuthorities": [
    "51312d91ac6fc6e35005c23656b0effa159c89e4b21e56e054d5af52adc7c272"
  ]
}
