{
  "manifestVersion": 2,
  "name": "Neon Sentinel",
  "tagline": "Hold the relay, save the keys, don't get TIME LOCKED",
  "description": "A radar-first Nostr rescue shooter with Defender-style waves, a seeded daily gauntlet, and 600B pressure.",
  "genres": [
    "arcade",
    "shooter",
    "action"
  ],
  "gameId": "neonsentinel",
  "order": 2,
  "accent": "#22d3ee",
  "url": "https://neonsentinel.com/",
  "logoUrl": "https://neonsentinel.com/brand/icon-512.png",
  "heroUrl": "https://neonsentinel.com/brand/neon-sentinel-key-art-v2.png",
  "inputModes": [
    "gamepad",
    "keyboard",
    "touch"
  ],
  "controller": {
    "adapter": "native"
  },
  "controlHints": [
    "LEFT STICK / D-PAD = MOVE",
    "A / SPACE = FIRE",
    "START / ESC = PAUSE"
  ],
  "sessionMinutes": 5,
  "players": {
    "min": 1,
    "max": 1
  },
  "network": "required",
  "capabilities": {
    "nostrSign": true,
    "walletPay": false,
    "persistentStorage": true,
    "externalNavigation": false
  },
  "allowedOrigins": [
    "https://neonsentinel.com"
  ],
  "developer": "The Crypto Donkey",
  "tips": "profusemeat89@walletofsatoshi.com",
  "nostrHandoff": {
    "protocol": "gamestr-auth-v1",
    "editions": [
      "600"
    ],
    "signKinds": [
      30762,
      27235
    ]
  },
  "scoreAuthorities": [
    "370148bb752fee753c8dd436752e801f02913dbc7ac6330828d13d5540c4ca21"
  ]
}
