{
  "manifestVersion": 2,
  "name": "Sat Snake",
  "tagline": "Mobile-friendly Snake - collect sats, grow your stack",
  "url": "https://satsnake.whitepaperinteractive.com/",
  "gameId": "satsnake",
  "order": 17,
  "accent": "#10b981",
  "inputModes": ["gamepad", "keyboard"],
  "controller": { "adapter": "keyboard" },
  "controlHints": [
    "D-PAD / LEFT STICK = STEER",
    "A = PAUSE / RESUME / RESTART"
  ],
  "network": "required",
  "capabilities": { "nostrSign": true, "walletPay": false, "persistentStorage": false, "externalNavigation": false },
  "allowedOrigins": ["https://satsnake.whitepaperinteractive.com"]
}
