{
  "manifestVersion": 2,
  "name": "Nostrich Run",
  "tagline": "Endless runner with the Nostr mascot - how far can you go?",
  "url": "https://nostrichrun.whitepaperinteractive.com/",
  "gameId": "nostrich-run",
  "order": 16,
  "accent": "#a855f7",
  "inputModes": ["gamepad", "keyboard"],
  "controller": { "adapter": "hybrid" },
  "controlHints": [
    "LEFT STICK = CURSOR · A = OPEN GAME",
    "A / D-PAD UP = JUMP",
    "D-PAD DOWN = DUCK"
  ],
  "network": "required",
  "capabilities": { "nostrSign": true, "walletPay": false, "persistentStorage": false, "externalNavigation": false },
  "allowedOrigins": ["https://nostrichrun.whitepaperinteractive.com"]
}
