{
  "manifestVersion": 2,
  "name": "Unicorn vs Snakes",
  "tagline": "Dergigi's whimsical arcade - unicorn dodges the snakes",
  "url": "https://unicorn.dergigi.com/",
  "gameId": "unicornvssnakes",
  "order": 15,
  "accent": "#ec4899",
  "scoreKind": 5555,
  "scoreField": "score",
  "scoreDir": "desc",
  "inputModes": ["gamepad", "keyboard"],
  "controller": { "adapter": "hybrid" },
  "controlHints": [
    "LEFT STICK = CURSOR · A = SELECT MENUS",
    "D-PAD / LEFT STICK = MOVE",
    "A / D-PAD UP = JUMP · A = POWERED FIREBALL"
  ],
  "network": "required",
  "capabilities": { "nostrSign": true, "walletPay": false, "persistentStorage": false, "externalNavigation": false },
  "allowedOrigins": ["https://unicorn.dergigi.com"]
}
