{
  "manifestVersion": 2,
  "name": "Take Me To Your Ledger",
  "tagline": "No leaders. Only the ledger. Beam up cows and the cult.",
  "description": "Pilot a Roswell saucer over a moonlit valley. Abduct cows, carry 600B cult leaders to the sacred stone, dodge fiat drones and shotgun normies, and carve five tiers of crop formation ending in a standing Bitcoin mark. Beam up mothership supply drops for magnet, shield, overclock, double-points and time-warp power-ups, draft perks every wave, and bring down THE TAXMAN. Plays on keyboard, touch or gamepad.",
  "genres": [
    "arcade",
    "action",
    "casual"
  ],
  "gameId": "takemetoyourledger",
  "order": 6,
  "accent": "#f7931a",
  "url": "https://ledger.playechoseven.com/",
  "heroUrl": "https://ledger.playechoseven.com/img/hero.webp",
  "inputModes": [
    "keyboard",
    "touch",
    "gamepad"
  ],
  "controller": {
    "adapter": "native"
  },
  "controlHints": [
    "D-PAD / LEFT STICK = FLY",
    "A / RB / RT = BEAM \u00b7 X / LB = SPECIAL",
    "START = PAUSE \u00b7 D-PAD + A / B = MENUS"
  ],
  "network": "required",
  "capabilities": {
    "nostrSign": true,
    "walletPay": false,
    "persistentStorage": true,
    "externalNavigation": false
  },
  "allowedOrigins": [
    "https://ledger.playechoseven.com"
  ],
  "developer": "The Crypto Donkey",
  "tips": "profusemeat89@walletofsatoshi.com",
  "scoreAuthorities": [
    "6f0baf0c26e68afa787ff8c6e34e41f0395fb53fde4152e2c7bcb5f4674080c2"
  ],
  "nostrHandoff": {
    "protocol": "gamestr-auth-v1",
    "editions": [
      "600"
    ],
    "signKinds": [
      30762,
      27235
    ]
  }
}
