{
  "manifestVersion": 2,
  "name": "Snake",
  "tagline": "The classic, reimagined - grab the golden apple",
  "url": "https://npub1n0games63frevnx3llju3sypf2q4streuwzgr4wwd2y5hlqa5c9s29nfk3.nsite.run/game/naddr1qvzqqqyp7vpzpx73mhnp4zj8jexdrll9erqgzj5ptqk8ncuys82uu65ff07pmfstqqy8xmnpddjj6a33ae9uxl",
  "gameId": "nogames-snake-v1",
  "order": 22,
  "accent": "#22c55e",
  "heroUrl": "https://cdn.hzrd149.com/e19b12222085fa5fdc359f6d74acdcf8bbbbb310a1673542727552beda098340.svg",
  "textLogo": true,
  "source": "gamestr",
  "inputModes": ["gamepad", "keyboard"],
  "controller": { "adapter": "hybrid" },
  "controlHints": [
    "LEFT STICK = CURSOR · A = OPEN GAME",
    "D-PAD / LEFT STICK = STEER"
  ],
  "network": "required",
  "capabilities": { "nostrSign": true, "walletPay": false, "persistentStorage": false, "externalNavigation": false },
  "allowedOrigins": ["https://npub1n0games63frevnx3llju3sypf2q4streuwzgr4wwd2y5hlqa5c9s29nfk3.nsite.run"]
}
